{
  "version": 4,
  "subtitle": "Zvládneš zlomky i délky. Objevuj je krok za krokem!",
  "subject": "maths",
  "language": "cs-CZ",
  "id": "zlomky-a-prevody-delky",
  "topic": "Zlomky a převody jednotek délky",
  "audience": "Pro děti kolem 10 let.",
  "highlights": [
    {"target": "original.0.text", "quote": "části z celku", "color": "yellow"},
    {"target": "original.0.text", "quote": "převody jednotek délky", "color": "blue"},
    {"target": "examples.0.steps.0.calculation", "quote": "20 : 4 = 5", "color": "yellow"},
    {"target": "exercises.0.prompt", "quote": "jmenovatel", "color": "blue"}
  ],
  "original": [
    {"heading": "Zadání", "icon": "📐", "style": "example", "text": "Výpočet části z celku pomocí zlomků a převody jednotek délky."}
  ],
  "glossary": [
    {"term": "zlomek", "icon": "🍰", "definition": "Zapisuje část celku, například 3/4. Celek rozdělíme na čtyři stejně velké části a vezmeme tři z nich.", "forms": ["zlomky", "zlomku", "zlomků"]},
    {"term": "čitatel", "definition": "Číslo nad zlomkovou čarou. Říká, kolik stejných částí bereme. Ve zlomku 3/4 je to 3.", "forms": ["čitatele", "čitatelem"]},
    {"term": "jmenovatel", "definition": "Číslo pod zlomkovou čarou. Říká, na kolik stejných částí dělíme celek. Ve zlomku 3/4 je to 4. Nesmí být nula.", "forms": ["jmenovatele", "jmenovatelem"]},
    {"term": "celek", "definition": "Celé množství, ze kterého počítáme část. Část zjistíme dělením jmenovatelem a násobením čitatelem.", "forms": ["celku"]},
    {"term": "rovnocenné zlomky", "definition": "Zlomky se stejnou hodnotou, například 1/2 a 2/4. Čitatele i jmenovatele násobíme nebo dělíme stejným nenulovým číslem.", "forms": ["rovnocenný zlomek"]},
    {"term": "jednotka délky", "definition": "Říká, v čem délku měříme. Platí 1 km = 1000 m, 1 m = 10 dm, 1 dm = 10 cm a 1 cm = 10 mm. Proto 1 m = 100 cm = 1000 mm. Na menší jednotku násobíme, na větší dělíme.", "forms": ["jednotky délky", "jednotek délky"]},
    {"term": "desetinné číslo", "definition": "Čárka odděluje celou část od části menší než jedna. Například 1,25 m je 1 m a 25 cm. Čtvrtina je 1/4 = 0,25.", "forms": ["desetinná čísla"]},
    {"term": "rovnice", "definition": "Rovnost s neznámým číslem, například x + 20 = 200. Písmeno x zastupuje číslo, které hledáme.", "forms": ["rovnici"]},
    {"term": "porovnání", "definition": "Znak = znamená stejně, < menší, > větší a <> nestejně. Délky porovnávej ve stejné jednotce.", "forms": ["porovnávat"]}
  ],
  "examples": [
    {
      "kind": "simple", "heading": "1. Část celku a různé zápisy", "icon": "🍰",
      "prompt": "V krabičce je 20 korálků. Tři čtvrtiny jsou modré. Kolik modrých korálků je v krabičce?",
      "hint": "Nejprve najdi jednu čtvrtinu dělením čtyřmi. Potom vezmi tři takové části.",
      "paragraphs": [
        {"style": "note", "text": "Lehká otázka ověřuje porozumění: Je jmenovatel počet stejných částí celku? Ano. Je možné dělit nulou? Ne, takové dělení není definované."},
        {"style": "example", "text": "Polovina z 12 je 12 : 2 = 6. Čtvrtina je 1 : 4 = 0,25. Rovnocenné zápisy: 1/2 = 2/4 = 0,5 a 7/4 = 1 3/4 = 1,75. Zlomek 3/6 zkrátíme dělením obou čísel třemi: 1/2."},
        {"style": "tip", "text": "Při porovnání zlomků se stejným jmenovatelem porovnej čitatele: 1/4 < 3/4. Dvě poloviny tvoří celek: 2/2 = 1. Zápis 1/2 <> 1/4 říká, že hodnoty nejsou stejné."}
      ],
      "steps": [
        {"calculation": "20 : 4 = 5", "explanation": "Jmenovatel určuje počet stejných částí. Jedna čtvrtina z 20 je 5."},
        {"calculation": "5 × 3 = 15", "explanation": "Čitatel určuje, kolik částí vezmeme. Tři čtvrtiny z 20 jsou 15."}
      ],
      "answer": "Modrých korálků je 15. Počet korálků zapisujeme číslem 15, ne zlomkem 3/4."
    },
    {
      "kind": "complex", "heading": "2. Jeden výpočet, převod a rovnice",
      "prompt": "Převeď 1,25 m na centimetry. Potom si ukaž jeden samostatný výpočet a jednu rovnici.",
      "hint": "Metry na centimetry převádíme násobením stem. U rovnice najdi číslo, které po přičtení 20 dává 200.",
      "paragraphs": [
        {"style": "note", "text": "Mezi mm, cm, dm a m je v každém sousedním kroku faktor 10. Mezi km a m je faktor 1000. Délka se převodem nemění. Na větší jednotku dělíme: 135 mm = 13,5 cm."},
        {"style": "example", "text": "Střední výběr může nabídnout čísla, slova nebo znaky. Pro 1 m a 100 cm vyber =. Pro 1/4 a 3/4 vyber <. Pro 3/4 a 1/4 vyber >. Znak <> značí nestejně, například 1/2 <> 1/4."},
        {"style": "tip", "text": "Střední číselné zadání má právě jeden výpočet a matematický zápis, ne příběh. Zápis x + 20 = 200 žádá pouze číselnou hodnotu x. Napiš 180, ne x = 180. V převodu je jednotka v zadání, do pole patří jen číslo."}
      ],
      "steps": [
        {"calculation": "1,25 × 100 = 125; 1,25 m = 125 cm", "explanation": "Násobení 100 posune čárku o dvě místa doprava. Naopak 125 : 100 = 1,25."},
        {"calculation": "30 × 60 = 1800", "explanation": "3 × 6 = 18 a dvě desítky dají faktor 100. Proto 30 × 60 = 18 × 100 = 1800."},
        {"calculation": "x = 200 − 20 = 180; kontrola: 180 + 20 = 200", "explanation": "Přičítání 20 zrušíme odečtením 20. Hledané číslo určí jeden výpočet. Kontrola ověří rovnost."}
      ],
      "answer": "1,25 m je 125 cm, součin je 1800 a v rovnici je x rovno 180."
    },
    {
      "kind": "everyday", "heading": "3. Stuha na dárek",
      "prompt": "Máš 2 m stuhy. Na dárek použiješ 3/4 celé stuhy. Kolik centimetrů měří celek, kolik použiješ a kolik zůstane?",
      "hint": "Převeď celek na centimetry, vypočítej jeho část a pak ji odečti.",
      "paragraphs": [
        {"style": "example", "text": "Stejné kusy: z 60 cm uděláš 5 dílů po 12 cm, protože 60 : 12 = 5. Naopak 5 dílů po 12 cm měří 5 × 12 = 60 cm. Prodloužení o třetinu: ke 150 cm přidáš 150 : 3 = 50 cm, celkem 200 cm."},
        {"style": "tip", "text": "Při sčítání a odčítání používej stejnou jednotku. Například 1,2 m + 80 cm = 120 cm + 80 cm = 200 cm. Část ze zbytku počítej až po odečtení použité části."}
      ],
      "steps": [
        {"calculation": "2 × 100 = 200 cm", "explanation": "Celou délku převedeme na centimetry."},
        {"calculation": "200 : 4 × 3 = 150 cm", "explanation": "Ze čtyř stejných částí bereme tři."},
        {"calculation": "200 − 150 = 50 cm", "explanation": "Použitou délku odečteme od celku. Kontrola: 150 + 50 = 200."}
      ],
      "answer": "Celek měří 200 cm, použiješ 150 cm a zůstane 50 cm. Každá odpověď má vlastní body."
    },
    {
      "kind": "challenge", "heading": "4. Část trasy a rozdělení zbytku",
      "prompt": "Trasa výletu měří 2,4 km. Ráno ujdeš 1/4 trasy. Zbytek rozdělíš na tři stejně dlouhé úseky. Kolik metrů měří celek, ranní cesta, zbytek a další úsek?",
      "hint": "Převeď kilometry na metry, najdi čtvrtinu, odečti ji a zbytek rozděl třemi.",
      "steps": [
        {"calculation": "2,4 × 1000 = 2400 m", "explanation": "Kilometr obsahuje tisíc metrů."},
        {"calculation": "2400 : 4 = 600 m", "explanation": "Ranní cesta je jedna ze čtyř stejných částí."},
        {"calculation": "2400 − 600 = 1800 m", "explanation": "Zbytek nyní tvoří nový celek pro dělení."},
        {"calculation": "1800 : 3 = 600 m", "explanation": "Každý další úsek je třetina ze zbytku, ne z původní délky."}
      ],
      "answer": "Celek: 2400 m, ráno: 600 m, zbytek: 1800 m, další úsek: 600 m. V kvízu napiš jen čísla."
    }
  ],
  "exercises": [
    {"id": "jmenovatel-casti", "difficulty": "easy", "type": "trueFalse", "prompt": "Říká jmenovatel, na kolik stejných částí dělíme celek?", "options": ["Ano", "Ne"], "answer": 0, "assessment": {"input": "number", "exact": {"type": "number", "value": "0"}}, "hint": "Vzpomeň si na spodní číslo ve zlomku 3/4.", "solution": "Ano. Jmenovatel 4 rozděluje celek na čtyři stejné části.", "explanation": "Čitatel pak říká, kolik těchto částí vezmeme."},
    {"id": "citatel-casti", "difficulty": "easy", "type": "trueFalse", "prompt": "Říká čitatel, kolik stejných částí bereme?", "options": ["Ano", "Ne"], "answer": 0, "assessment": {"input": "number", "exact": {"type": "number", "value": "0"}}, "hint": "Podívej se na horní číslo zlomku.", "solution": "Ano. Ve zlomku 3/4 bereme tři ze čtyř částí.", "explanation": "Horní číslo určuje počet vybraných částí."},
    {"id": "deleni-nulou", "difficulty": "easy", "type": "trueFalse", "prompt": "Může být jmenovatel zlomku nula?", "options": ["Ano", "Ne"], "answer": 1, "assessment": {"input": "number", "exact": {"type": "number", "value": "1"}}, "hint": "Zlomková čára znamená také dělení.", "solution": "Ne. Dělení nulou není definované.", "explanation": "Jmenovatel musí být nenulový."},
    {"id": "mensi-jednotka", "difficulty": "easy", "type": "trueFalse", "prompt": "Při převodu metrů na centimetry násobíme?", "options": ["Ano", "Ne"], "answer": 0, "assessment": {"input": "number", "exact": {"type": "number", "value": "0"}}, "hint": "Do jednoho metru se vejde mnoho centimetrů.", "solution": "Ano. Centimetr je menší jednotka: 1 m = 100 cm.", "explanation": "Menších jednotek potřebujeme na stejnou délku více."},
    {"id": "kilometr-faktor", "difficulty": "easy", "type": "trueFalse", "prompt": "Je mezi kilometry a metry převodní faktor 10?", "options": ["Ano", "Ne"], "answer": 1, "assessment": {"input": "number", "exact": {"type": "number", "value": "1"}}, "hint": "Vzpomeň si, kolik metrů má jeden kilometr.", "solution": "Ne. 1 km = 1000 m, faktor je 1000.", "explanation": "Kilometry a metry nejsou sousední kroky s faktorem 10."},
    {"id": "stejna-delka", "difficulty": "easy", "type": "trueFalse", "prompt": "Změní se skutečná délka provazu, když ji zapíšeme jinou jednotkou?", "options": ["Ano", "Ne"], "answer": 1, "assessment": {"input": "number", "exact": {"type": "number", "value": "1"}}, "hint": "Provaz při převodu nestříháme ani neprodlužujeme.", "solution": "Ne. 1 m a 100 cm označují stejnou délku.", "explanation": "Mění se číslo a jednotka, nikoli měřená délka."},